{
  "$schema": "https://json-schema.org/draft/2020-12/schema",
  "$id": "https://mockinterview.local/schemas/question.schema.json",
  "title": "InterviewQuestion",
  "type": "object",
  "required": [
    "id",
    "technology",
    "topic",
    "difficulty",
    "type",
    "question",
    "canonicalAnswer",
    "expectedConcepts",
    "followUps",
    "source",
    "reviewStatus",
    "version"
  ],
  "properties": {
    "id": { "type": "string", "minLength": 3 },
    "technology": { "type": "string", "minLength": 2 },
    "topic": { "type": "string", "minLength": 2 },
    "difficulty": { "enum": ["beginner", "intermediate", "advanced"] },
    "type": { "enum": ["conceptual", "scenario", "troubleshooting", "design", "hands-on"] },
    "question": { "type": "string", "minLength": 10 },
    "canonicalAnswer": { "type": "string", "minLength": 20 },
    "expectedConcepts": {
      "type": "array",
      "minItems": 1,
      "items": { "type": "string", "minLength": 1 }
    },
    "followUps": {
      "type": "array",
      "items": { "type": "string", "minLength": 5 }
    },
    "source": {
      "type": "object",
      "required": ["title", "url", "verified"],
      "properties": {
        "title": { "type": "string" },
        "url": { "type": "string", "format": "uri" },
        "verified": { "type": "string", "format": "date" }
      },
      "additionalProperties": false
    },
    "reviewStatus": {
      "enum": ["draft", "ai-reviewed", "human-reviewed", "approved", "needs-review", "deprecated"]
    },
    "version": { "type": "integer", "minimum": 1 }
  },
  "additionalProperties": false
}
